"","Indicator_Code","Indicator_Name","Num_of_Countries","Num_of_Years","FirstYear","LastYear"
"1","AG.AGR.TRAC.NO","Agricultural machinery, tractors",233,49,"1961","2009"
"2","AG.CON.FERT.PT.ZS","Fertilizer consumption (% of fertilizer production)",132,13,"2002","2014"
"3","AG.CON.FERT.ZS","Fertilizer consumption (kilograms per hectare of arable land)",207,13,"2002","2014"
"4","AG.LND.AGRI.K2","Agricultural land (sq. km)",257,55,"1961","2015"
"5","AG.LND.AGRI.ZS","Agricultural land (% of land area)",256,55,"1961","2015"
"6","AG.LND.ARBL.HA","Arable land (hectares)",208,55,"1961","2015"
"7","AG.LND.ARBL.HA.PC","Arable land (hectares per person)",254,55,"1961","2015"
"8","AG.LND.ARBL.ZS","Arable land (% of land area)",254,55,"1961","2015"
"9","AG.LND.CREL.HA","Land under cereal production (hectares)",227,54,"1961","2014"
"10","AG.LND.CROP.ZS","Permanent cropland (% of land area)",243,55,"1961","2015"
"11","AG.LND.EL5M.RU.K2","Rural land area where elevation is below 5 meters (sq. km)",225,3,"1990","2010"
"12","AG.LND.EL5M.RU.ZS","Rural land area where elevation is below 5 meters (% of total land area)",223,3,"1990","2010"
"13","AG.LND.EL5M.UR.K2","Urban land area where elevation is below 5 meters (sq. km)",225,3,"1990","2010"
"14","AG.LND.EL5M.UR.ZS","Urban land area where elevation is below 5 meters (% of total land area)",223,3,"1990","2010"
"15","AG.LND.EL5M.ZS","Land area where elevation is below 5 meters (% of total land area)",223,3,"1990","2010"
"16","AG.LND.FRST.K2","Forest area (sq. km)",257,26,"1990","2015"
"17","AG.LND.FRST.ZS","Forest area (% of land area)",256,26,"1990","2015"
"18","AG.LND.IRIG.AG.ZS","Agricultural irrigated land (% of total agricultural land)",119,15,"2001","2015"
"19","AG.LND.PRCP.MM","Average precipitation in depth (mm per year)",191,12,"1962","2014"
"20","AG.LND.TOTL.K2","Land area (sq. km)",262,57,"1961","2017"
"21","AG.LND.TOTL.RU.K2","Rural land area (sq. km)",225,3,"1990","2010"
"22","AG.LND.TOTL.UR.K2","Urban land area (sq. km)",225,3,"1990","2010"
"23","AG.LND.TRAC.ZS","Agricultural machinery, tractors per 100 sq. km of arable land",230,49,"1961","2009"
"24","AG.PRD.CREL.MT","Cereal production (metric tons)",227,54,"1961","2014"
"25","AG.PRD.CROP.XD","Crop production index (2004-2006 = 100)",246,54,"1961","2014"
"26","AG.PRD.FOOD.XD","Food production index (2004-2006 = 100)",248,54,"1961","2014"
"27","AG.PRD.LVSK.XD","Livestock production index (2004-2006 = 100)",247,54,"1961","2014"
"28","AG.SRF.TOTL.K2","Surface area (sq. km)",263,57,"1961","2017"
"29","AG.YLD.CREL.KG","Cereal yield (kg per hectare)",227,54,"1961","2014"
"30","BG.GSR.NFSV.GD.ZS","Trade in services (% of GDP)",235,57,"1960","2016"
"31","BM.GSR.CMCP.ZS","Communications, computer, etc. (% of service imports, BoP)",238,57,"1960","2016"
"32","BM.GSR.FCTY.CD","Primary income payments (BoP, current USdollar)",239,57,"1960","2016"
"33","BM.GSR.GNFS.CD","Imports of goods and services (BoP, current USdollar)",238,57,"1960","2016"
"34","BM.GSR.INSF.ZS","Insurance and financial services (% of service imports, BoP)",238,57,"1960","2016"
"35","BM.GSR.MRCH.CD","Goods imports (BoP, current USdollar)",238,57,"1960","2016"
"36","BM.GSR.NFSV.CD","Service imports (BoP, current USdollar)",238,57,"1960","2016"
"37","BM.GSR.ROYL.CD","Charges for the use of intellectual property, payments (BoP, current USdollar)",232,57,"1960","2016"
"38","BM.GSR.TOTL.CD","Imports of goods, services and primary income (BoP, current USdollar)",238,57,"1960","2016"
"39","BM.GSR.TRAN.ZS","Transport services (% of service imports, BoP)",238,57,"1960","2016"
"40","BM.GSR.TRVL.ZS","Travel services (% of service imports, BoP)",237,57,"1960","2016"
"41","BM.KLT.DINV.CD.WD","Foreign direct investment, net outflows (BoP, current USdollar)",236,47,"1970","2016"
"42","BM.KLT.DINV.WD.GD.ZS","Foreign direct investment, net outflows (% of GDP)",231,47,"1970","2016"
"43","BM.TRF.PRVT.CD","Secondary income, other sectors, payments (BoP, current USdollar)",239,57,"1960","2016"
"44","BM.TRF.PWKR.CD.DT","Personal remittances, paid (current USdollar)",239,47,"1970","2016"
"45","BN.CAB.XOKA.CD","Current account balance (BoP, current USdollar)",194,57,"1960","2016"
"46","BN.CAB.XOKA.GD.ZS","Current account balance (% of GDP)",189,57,"1960","2016"
"47","BN.FIN.TOTL.CD","Net financial account (BoP, current USdollar)",193,57,"1960","2016"
"48","BN.GSR.FCTY.CD","Net primary income (BoP, current USdollar)",194,57,"1960","2016"
"49","BN.GSR.GNFS.CD","Net trade in goods and services (BoP, current USdollar)",194,57,"1960","2016"
"50","BN.GSR.MRCH.CD","Net trade in goods (BoP, current USdollar)",194,57,"1960","2016"
"51","BN.KAC.EOMS.CD","Net errors and omissions (BoP, current USdollar)",193,57,"1960","2016"
"52","BN.KLT.DINV.CD","Foreign direct investment, net (BoP, current USdollar)",193,57,"1960","2016"
"53","BN.KLT.PTXL.CD","Portfolio investment, net (BoP, current USdollar)",190,57,"1960","2016"
"54","BN.RES.INCL.CD","Reserves and related items (BoP, current USdollar)",193,57,"1960","2016"
"55","BN.TRF.CURR.CD","Net secondary income (BoP, current USdollar)",194,57,"1960","2016"
"56","BN.TRF.KOGT.CD","Net capital account (BoP, current USdollar)",193,57,"1960","2016"
"57","BX.GRT.EXTA.CD.WD","Grants, excluding technical cooperation (BoP, current USdollar)",180,56,"1960","2015"
"58","BX.GRT.TECH.CD.WD","Technical cooperation grants (BoP, current USdollar)",180,56,"1960","2015"
"59","BX.GSR.CCIS.CD","ICT service exports (BoP, current USdollar)",234,57,"1960","2016"
"60","BX.GSR.CCIS.ZS","ICT service exports (% of service exports, BoP)",234,57,"1960","2016"
"61","BX.GSR.CMCP.ZS","Communications, computer, etc. (% of service exports, BoP)",238,57,"1960","2016"
"62","BX.GSR.FCTY.CD","Primary income receipts (BoP, current USdollar)",239,57,"1960","2016"
"63","BX.GSR.GNFS.CD","Exports of goods and services (BoP, current USdollar)",236,57,"1960","2016"
"64","BX.GSR.INSF.ZS","Insurance and financial services (% of service exports, BoP)",235,57,"1960","2016"
"65","BX.GSR.MRCH.CD","Goods exports (BoP, current USdollar)",236,57,"1960","2016"
"66","BX.GSR.NFSV.CD","Service exports (BoP, current USdollar)",236,57,"1960","2016"
"67","BX.GSR.ROYL.CD","Charges for the use of intellectual property, receipts (BoP, current USdollar)",231,57,"1960","2016"
"68","BX.GSR.TOTL.CD","Exports of goods, services and primary income (BoP, current USdollar)",236,57,"1960","2016"
"69","BX.GSR.TRAN.ZS","Transport services (% of service exports, BoP)",237,57,"1960","2016"
"70","BX.GSR.TRVL.ZS","Travel services (% of service exports, BoP)",236,57,"1960","2016"
"71","BX.KLT.DINV.CD.WD","Foreign direct investment, net inflows (BoP, current USdollar)",248,47,"1970","2016"
"72","BX.KLT.DINV.WD.GD.ZS","Foreign direct investment, net inflows (% of GDP)",243,47,"1970","2016"
"73","BX.KLT.DREM.CD.DT","Primary income on FDI, payments (current USdollar)",135,47,"1970","2016"
"74","BX.PEF.TOTL.CD.WD","Portfolio equity, net inflows (BoP, current USdollar)",233,57,"1960","2016"
"75","BX.TRF.CURR.CD","Secondary income receipts (BoP, current USdollar)",239,57,"1960","2016"
"76","BX.TRF.PWKR.CD","Personal transfers, receipts (BoP, current USdollar)",230,57,"1960","2016"
"77","BX.TRF.PWKR.CD.DT","Personal remittances, received (current USdollar)",238,47,"1970","2016"
"78","BX.TRF.PWKR.DT.GD.ZS","Personal remittances, received (% of GDP)",233,47,"1970","2016"
"79","CM.MKT.INDX.ZG","S&P Global Equity Indices (annual % change)",84,27,"1990","2016"
"80","CM.MKT.LCAP.CD","Market capitalization of listed domestic companies (current USdollar)",133,42,"1975","2016"
"81","CM.MKT.LCAP.GD.ZS","Market capitalization of listed domestic companies (% of GDP)",133,42,"1975","2016"
"82","CM.MKT.LDOM.NO","Listed domestic companies, total",140,42,"1975","2016"
"83","CM.MKT.TRAD.CD","Stocks traded, total value (current USdollar)",137,42,"1975","2016"
"84","CM.MKT.TRAD.GD.ZS","Stocks traded, total value (% of GDP)",137,42,"1975","2016"
"85","CM.MKT.TRNR","Stocks traded, turnover ratio of domestic shares (%)",141,42,"1975","2016"
"86","DC.DAC.AUSL.CD","Net bilateral aid flows from DAC donors, Australia (current USdollar)",218,51,"1965","2015"
"87","DC.DAC.AUTL.CD","Net bilateral aid flows from DAC donors, Austria (current USdollar)",208,56,"1960","2015"
"88","DC.DAC.BELL.CD","Net bilateral aid flows from DAC donors, Belgium (current USdollar)",210,56,"1960","2015"
"89","DC.DAC.CANL.CD","Net bilateral aid flows from DAC donors, Canada (current USdollar)",216,56,"1960","2015"
"90","DC.DAC.CECL.CD","Net bilateral aid flows from DAC donors, European Union institutions (current USdollar)",222,56,"1960","2015"
"91","DC.DAC.CHEL.CD","Net bilateral aid flows from DAC donors, Switzerland (current USdollar)",210,56,"1960","2015"
"92","DC.DAC.CZEL.CD","Net bilateral aid flows from DAC donors, Czech Republic (current USdollar)",171,11,"2005","2015"
"93","DC.DAC.DEUL.CD","Net bilateral aid flows from DAC donors, Germany (current USdollar)",222,56,"1960","2015"
"94","DC.DAC.DNKL.CD","Net bilateral aid flows from DAC donors, Denmark (current USdollar)",193,56,"1960","2015"
"95","DC.DAC.ESPL.CD","Net bilateral aid flows from DAC donors, Spain (current USdollar)",206,36,"1980","2015"
"96","DC.DAC.FINL.CD","Net bilateral aid flows from DAC donors, Finland (current USdollar)",212,46,"1970","2015"
"97","DC.DAC.FRAL.CD","Net bilateral aid flows from DAC donors, France (current USdollar)",221,56,"1960","2015"
"98","DC.DAC.GBRL.CD","Net bilateral aid flows from DAC donors, United Kingdom (current USdollar)",221,56,"1960","2015"
"99","DC.DAC.GRCL.CD","Net bilateral aid flows from DAC donors, Greece (current USdollar)",204,20,"1996","2015"
"100","DC.DAC.IRLL.CD","Net bilateral aid flows from DAC donors, Ireland (current USdollar)",190,42,"1974","2015"
"101","DC.DAC.ISLL.CD","Net bilateral aid flows from DAC donors, Iceland (current USdollar)",87,21,"1992","2015"
"102","DC.DAC.ITAL.CD","Net bilateral aid flows from DAC donors, Italy (current USdollar)",210,56,"1960","2015"
"103","DC.DAC.JPNL.CD","Net bilateral aid flows from DAC donors, Japan (current USdollar)",222,56,"1960","2015"
"104","DC.DAC.KORL.CD","Net bilateral aid flows from DAC donors, Korea, Rep. (current USdollar)",211,56,"1960","2015"
"105","DC.DAC.LUXL.CD","Net bilateral aid flows from DAC donors, Luxembourg (current USdollar)",188,26,"1990","2015"
"106","DC.DAC.NLDL.CD","Net bilateral aid flows from DAC donors, Netherlands (current USdollar)",214,55,"1960","2015"
"107","DC.DAC.NORL.CD","Net bilateral aid flows from DAC donors, Norway (current USdollar)",211,56,"1960","2015"
"108","DC.DAC.NZLL.CD","Net bilateral aid flows from DAC donors, New Zealand (current USdollar)",183,46,"1970","2015"
"109","DC.DAC.POLL.CD","Net bilateral aid flows from DAC donors, Poland (current USdollar)",164,11,"2005","2015"
"110","DC.DAC.PRTL.CD","Net bilateral aid flows from DAC donors, Portugal (current USdollar)",174,33,"1960","2015"
"111","DC.DAC.SVKL.CD","Net bilateral aid flows from DAC donors, Slovak Republic (current USdollar)",111,11,"2005","2015"
"112","DC.DAC.SVNL.CD","Net bilateral aid flows from DAC donors, Slovenia (current USdollar)",125,8,"2008","2015"
"113","DC.DAC.SWEL.CD","Net bilateral aid flows from DAC donors, Sweden (current USdollar)",203,55,"1960","2015"
"114","DC.DAC.TOTL.CD","Net bilateral aid flows from DAC donors, Total (current USdollar)",225,56,"1960","2015"
"115","DC.DAC.USAL.CD","Net bilateral aid flows from DAC donors, United States (current USdollar)",219,56,"1960","2015"
"116","DT.AMT.BLAT.CD","PPG, bilateral (AMT, current USdollar)",135,48,"1970","2017"
"117","DT.AMT.BLTC.CD","PPG, bilateral concessional (AMT, current USdollar)",135,47,"1970","2016"
"118","DT.AMT.DIMF.CD","IMF repurchases (AMT, current USdollar)",135,47,"1970","2016"
"119","DT.AMT.DLTF.CD","Principal repayments on external debt, long-term + IMF (AMT, current USdollar)",135,47,"1970","2016"
"120","DT.AMT.DLXF.CD","Principal repayments on external debt, long-term (AMT, current USdollar)",135,48,"1970","2017"
"121","DT.AMT.DPNG.CD","Principal repayments on external debt, private nonguaranteed (PNG) (AMT, current USdollar)",135,48,"1970","2017"
"122","DT.AMT.DPPG.CD","Principal repayments on external debt, public and publicly guaranteed (PPG) (AMT, current USdollar)",135,47,"1970","2016"
"123","DT.AMT.MIBR.CD","PPG, IBRD (AMT, current USdollar)",135,47,"1970","2016"
"124","DT.AMT.MIDA.CD","PPG, IDA (AMT, current USdollar)",135,47,"1970","2016"
"125","DT.AMT.MLAT.CD","PPG, multilateral (AMT, current USdollar)",135,48,"1970","2017"
"126","DT.AMT.MLTC.CD","PPG, multilateral concessional (AMT, current USdollar)",135,47,"1970","2016"
"127","DT.AMT.OFFT.CD","PPG, official creditors (AMT, current USdollar)",135,48,"1970","2017"
"128","DT.AMT.PBND.CD","PPG, bonds (AMT, current USdollar)",135,48,"1970","2017"
"129","DT.AMT.PCBK.CD","PPG, commercial banks (AMT, current USdollar)",135,48,"1970","2017"
"130","DT.AMT.PNGB.CD","PNG, bonds (AMT, current USdollar)",135,47,"1970","2016"
"131","DT.AMT.PNGC.CD","PNG, commercial banks and other creditors (AMT, current USdollar)",135,47,"1970","2016"
"132","DT.AMT.PROP.CD","PPG, other private creditors (AMT, current USdollar)",135,48,"1970","2017"
"133","DT.AMT.PRVT.CD","PPG, private creditors (AMT, current USdollar)",135,48,"1970","2017"
"134","DT.AXA.DPPG.CD","Principal arrears, long-term DOD (USdollar)",135,47,"1970","2016"
"135","DT.AXA.OFFT.CD","Principal arrears, official creditors (current USdollar)",135,47,"1970","2016"
"136","DT.AXA.PRVT.CD","Principal arrears, private creditors (current USdollar)",135,47,"1970","2016"
"137","DT.AXF.DPPG.CD","Principal forgiven (current USdollar)",135,47,"1970","2016"
"138","DT.AXR.DPPG.CD","Principal rescheduled (current USdollar)",135,47,"1970","2016"
"139","DT.AXR.OFFT.CD","Principal rescheduled, official (current USdollar)",135,47,"1970","2016"
"140","DT.AXR.PRVT.CD","Principal rescheduled, private (current USdollar)",135,47,"1970","2016"
"141","DT.COM.DPPG.CD","Commitments, public and publicly guaranteed (COM, current USdollar)",135,47,"1970","2016"
"142","DT.COM.MIBR.CD","Commitments, IBRD (COM, current USdollar)",135,47,"1970","2016"
"143","DT.COM.MIDA.CD","Commitments, IDA (COM, current USdollar)",135,47,"1970","2016"
"144","DT.COM.OFFT.CD","Commitments, official creditors (COM, current USdollar)",135,47,"1970","2016"
"145","DT.COM.PRVT.CD","Commitments, private creditors (COM, current USdollar)",135,47,"1970","2016"
"146","DT.CUR.DMAK.ZS","Currency composition of PPG debt, Deutsche mark (%)",135,47,"1970","2016"
"147","DT.CUR.EURO.ZS","Currency composition of PPG debt, Euro (%)",135,47,"1970","2016"
"148","DT.CUR.FFRC.ZS","Currency composition of PPG debt, French franc (%)",135,47,"1970","2016"
"149","DT.CUR.JYEN.ZS","Currency composition of PPG debt, Japanese yen (%)",135,47,"1970","2016"
"150","DT.CUR.MULC.ZS","Currency composition of PPG debt, Multiple currencies (%)",135,47,"1970","2016"
"151","DT.CUR.OTHC.ZS","Currency composition of PPG debt, all other currencies (%)",135,47,"1970","2016"
"152","DT.CUR.SDRW.ZS","Currency composition of PPG debt, SDR (%)",135,47,"1970","2016"
"153","DT.CUR.SWFR.ZS","Currency composition of PPG debt, Swiss franc (%)",135,47,"1970","2016"
"154","DT.CUR.UKPS.ZS","Currency composition of PPG debt, Pound sterling (%)",135,47,"1970","2016"
"155","DT.CUR.USDL.ZS","Currency composition of PPG debt, U.S. dollars (%)",135,47,"1970","2016"
"156","DT.DFR.DPPG.CD","Debt forgiveness or reduction (current USdollar)",135,47,"1970","2016"
"157","DT.DIS.BLAT.CD","PPG, bilateral (DIS, current USdollar)",135,48,"1970","2017"
"158","DT.DIS.BLTC.CD","PPG, bilateral concessional (DIS, current USdollar)",135,47,"1970","2016"
"159","DT.DIS.DIMF.CD","IMF purchases (DIS, current USdollar)",135,47,"1970","2016"
"160","DT.DIS.DLTF.CD","Disbursements on external debt, long-term + IMF (DIS, current USdollar)",135,47,"1970","2016"
"161","DT.DIS.DLXF.CD","Disbursements on external debt, long-term (DIS, current USdollar)",135,48,"1970","2017"
"162","DT.DIS.DPNG.CD","Disbursements on external debt, private nonguaranteed (PNG) (DIS, current USdollar)",135,47,"1970","2016"
"163","DT.DIS.DPPG.CD","Disbursements on external debt, public and publicly guaranteed (PPG) (DIS, current USdollar)",135,47,"1970","2016"
"164","DT.DIS.IDAG.CD","IDA grants (current USdollar)",135,47,"1970","2016"
"165","DT.DIS.MIBR.CD","PPG, IBRD (DIS, current USdollar)",135,47,"1970","2016"
"166","DT.DIS.MIDA.CD","PPG, IDA (DIS, current USdollar)",135,47,"1970","2016"
"167","DT.DIS.MLAT.CD","PPG, multilateral (DIS, current USdollar)",135,48,"1970","2017"
"168","DT.DIS.MLTC.CD","PPG, multilateral concessional (DIS, current USdollar)",135,47,"1970","2016"
"169","DT.DIS.OFFT.CD","PPG, official creditors (DIS, current USdollar)",135,48,"1970","2017"
"170","DT.DIS.PBND.CD","PPG, bonds (DIS, current USdollar)",135,47,"1970","2016"
"171","DT.DIS.PCBK.CD","PPG, commercial banks (DIS, current USdollar)",135,48,"1970","2017"
"172","DT.DIS.PNGB.CD","PNG, bonds (DIS, current USdollar)",135,47,"1970","2016"
"173","DT.DIS.PNGC.CD","PNG, commercial banks and other creditors (DIS, current USdollar)",135,47,"1970","2016"
"174","DT.DIS.PROP.CD","PPG, other private creditors (DIS, current USdollar)",135,48,"1970","2017"
"175","DT.DIS.PRVT.CD","PPG, private creditors (DIS, current USdollar)",135,48,"1970","2017"
"176","DT.DOD.ALLC.CD","External debt stocks, concessional (DOD, current USdollar)",135,47,"1970","2016"
"177","DT.DOD.ALLC.ZS","Concessional debt (% of total external debt)",135,47,"1970","2016"
"178","DT.DOD.BLAT.CD","PPG, bilateral (DOD, current USdollar)",135,47,"1970","2016"
"179","DT.DOD.BLTC.CD","PPG, bilateral concessional (DOD, current USdollar)",135,47,"1970","2016"
"180","DT.DOD.DECT.CD","External debt stocks, total (DOD, current USdollar)",135,47,"1970","2016"
"181","DT.DOD.DECT.CD.CG","Total change in external debt stocks (current USdollar)",135,47,"1970","2016"
"182","DT.DOD.DECT.EX.ZS","External debt stocks (% of exports of goods, services and primary income)",134,47,"1970","2016"
"183","DT.DOD.DECT.GN.ZS","External debt stocks (% of GNI)",135,47,"1970","2016"
"184","DT.DOD.DIMF.CD","Use of IMF credit (DOD, current USdollar)",136,47,"1970","2016"
"185","DT.DOD.DLXF.CD","External debt stocks, long-term (DOD, current USdollar)",135,47,"1970","2016"
"186","DT.DOD.DPNG.CD","External debt stocks, private nonguaranteed (PNG) (DOD, current USdollar)",136,47,"1970","2016"
"187","DT.DOD.DPPG.CD","External debt stocks, public and publicly guaranteed (PPG) (DOD, current USdollar)",136,47,"1970","2016"
"188","DT.DOD.DSTC.CD","External debt stocks, short-term (DOD, current USdollar)",135,47,"1970","2016"
"189","DT.DOD.DSTC.IR.ZS","Short-term debt (% of total reserves)",148,47,"1970","2016"
"190","DT.DOD.DSTC.XP.ZS","Short-term debt (% of exports of goods, services and primary income)",152,47,"1970","2016"
"191","DT.DOD.DSTC.ZS","Short-term debt (% of total external debt)",135,47,"1970","2016"
"192","DT.DOD.MDRI.CD","Debt forgiveness grants (current USdollar)",135,47,"1970","2016"
"193","DT.DOD.MIBR.CD","PPG, IBRD (DOD, current USdollar)",136,47,"1970","2016"
"194","DT.DOD.MIDA.CD","PPG, IDA (DOD, current USdollar)",136,47,"1970","2016"
"195","DT.DOD.MLAT.CD","PPG, multilateral (DOD, current USdollar)",135,47,"1970","2016"
"196","DT.DOD.MLAT.ZS","Multilateral debt (% of total external debt)",135,47,"1970","2016"
"197","DT.DOD.MLTC.CD","PPG, multilateral concessional (DOD, current USdollar)",135,47,"1970","2016"
"198","DT.DOD.MWBG.CD","IBRD loans and IDA credits (DOD, current USdollar)",135,47,"1970","2016"
"199","DT.DOD.OFFT.CD","PPG, official creditors (DOD, current USdollar)",135,47,"1970","2016"
"200","DT.DOD.PBND.CD","PPG, bonds (DOD, current USdollar)",135,47,"1970","2016"
"201","DT.DOD.PCBK.CD","PPG, commercial banks (DOD, current USdollar)",135,47,"1970","2016"
"202","DT.DOD.PNGB.CD","PNG, bonds (DOD, current USdollar)",135,47,"1970","2016"
"203","DT.DOD.PNGC.CD","PNG, commercial banks and other creditors (DOD, current USdollar)",135,47,"1970","2016"
"204","DT.DOD.PROP.CD","PPG, other private creditors (DOD, current USdollar)",135,47,"1970","2016"
"205","DT.DOD.PRVS.CD","External debt stocks, long-term private sector (DOD, current USdollar)",135,47,"1970","2016"
"206","DT.DOD.PRVT.CD","PPG, private creditors (DOD, current USdollar)",135,47,"1970","2016"
"207","DT.DOD.PUBS.CD","External debt stocks, long-term public sector (DOD, current USdollar)",135,47,"1970","2016"
"208","DT.DOD.PVLX.CD","Present value of external debt (current USdollar)",135,1,"2016","2016"
"209","DT.DOD.PVLX.EX.ZS","Present value of external debt (% of exports of goods, services and primary income)",101,2,"2013","2016"
"210","DT.DOD.PVLX.GN.ZS","Present value of external debt (% of GNI)",117,2,"2013","2016"
"211","DT.DOD.RSDL.CD","Residual, debt stock-flow reconciliation (current USdollar)",135,47,"1970","2016"
"212","DT.DOD.VTOT.CD","External debt stocks, variable rate (DOD, current USdollar)",135,47,"1970","2016"
"213","DT.DSB.DPPG.CD","Debt buyback (current USdollar)",135,47,"1970","2016"
"214","DT.DSF.DPPG.CD","Debt stock reduction (current USdollar)",135,47,"1970","2016"
"215","DT.DXR.DPPG.CD","Debt stock rescheduled (current USdollar)",135,47,"1970","2016"
"216","DT.GPA.DPPG","Average grace period on new external debt commitments (years)",135,47,"1970","2016"
"217","DT.GPA.OFFT","Average grace period on new external debt commitments, official (years)",135,47,"1970","2016"
"218","DT.GPA.PRVT","Average grace period on new external debt commitments, private (years)",135,47,"1970","2016"
"219","DT.GRE.DPPG","Average grant element on new external debt commitments (%)",135,47,"1970","2016"
"220","DT.GRE.OFFT","Average grant element on new external debt commitments, official (%)",135,47,"1970","2016"
"221","DT.GRE.PRVT","Average grant element on new external debt commitments, private (%)",135,47,"1970","2016"
"222","DT.INR.DPPG","Average interest on new external debt commitments (%)",135,47,"1970","2016"
"223","DT.INR.OFFT","Average interest on new external debt commitments, official (%)",135,47,"1970","2016"
"224","DT.INR.PRVT","Average interest on new external debt commitments, private (%)",135,47,"1970","2016"
"225","DT.INT.BLAT.CD","PPG, bilateral (INT, current USdollar)",135,48,"1970","2017"
"226","DT.INT.BLTC.CD","PPG, bilateral concessional (INT, current USdollar)",135,47,"1970","2016"
"227","DT.INT.DECT.CD","Interest payments on external debt, total (INT, current USdollar)",135,47,"1970","2016"
"228","DT.INT.DECT.EX.ZS","Interest payments on external debt (% of exports of goods, services and primary income)",134,47,"1970","2016"
"229","DT.INT.DECT.GN.ZS","Interest payments on external debt (% of GNI)",135,47,"1970","2016"
"230","DT.INT.DIMF.CD","IMF charges (INT, current USdollar)",135,47,"1970","2016"
"231","DT.INT.DLXF.CD","Interest payments on external debt, long-term (INT, current USdollar)",135,48,"1970","2017"
"232","DT.INT.DPNG.CD","Interest payments on external debt, private nonguaranteed (PNG) (INT, current USdollar)",135,48,"1970","2017"
"233","DT.INT.DPPG.CD","Interest payments on external debt, public and publicly guaranteed (PPG) (INT, current USdollar)",135,47,"1970","2016"
"234","DT.INT.DSTC.CD","Interest payments on external debt, short-term (INT, current USdollar)",135,47,"1970","2016"
"235","DT.INT.MIBR.CD","PPG, IBRD (INT, current USdollar)",135,47,"1970","2016"
"236","DT.INT.MIDA.CD","PPG, IDA (INT, current USdollar)",135,47,"1970","2016"
"237","DT.INT.MLAT.CD","PPG, multilateral (INT, current USdollar)",135,48,"1970","2017"
"238","DT.INT.MLTC.CD","PPG, multilateral concessional (INT, current USdollar)",135,47,"1970","2016"
"239","DT.INT.OFFT.CD","PPG, official creditors (INT, current USdollar)",135,48,"1970","2017"
"240","DT.INT.PBND.CD","PPG, bonds (INT, current USdollar)",135,48,"1970","2017"
"241","DT.INT.PCBK.CD","PPG, commercial banks (INT, current USdollar)",135,48,"1970","2017"
"242","DT.INT.PNGB.CD","PNG, bonds (INT, current USdollar)",135,47,"1970","2016"
"243","DT.INT.PNGC.CD","PNG, commercial banks and other creditors (INT, current USdollar)",135,47,"1970","2016"
"244","DT.INT.PROP.CD","PPG, other private creditors (INT, current USdollar)",135,48,"1970","2017"
"245","DT.INT.PRVT.CD","PPG, private creditors (INT, current USdollar)",135,48,"1970","2017"
"246","DT.IXA.DPPG.CD","Interest arrears, long-term DOD (USdollar)",135,47,"1970","2016"
"247","DT.IXA.DPPG.CD.CG","Net change in interest arrears (current USdollar)",135,47,"1970","2016"
"248","DT.IXA.OFFT.CD","Interest arrears, official creditors (current USdollar)",135,47,"1970","2016"
"249","DT.IXA.PRVT.CD","Interest arrears, private creditors (current USdollar)",135,47,"1970","2016"
"250","DT.IXF.DPPG.CD","Interest forgiven (current USdollar)",135,47,"1970","2016"
"251","DT.IXR.DPPG.CD","Interest rescheduled (capitalized) (current USdollar)",135,47,"1970","2016"
"252","DT.IXR.OFFT.CD","Interest rescheduled, official (current USdollar)",135,47,"1970","2016"
"253","DT.IXR.PRVT.CD","Interest rescheduled, private (current USdollar)",135,47,"1970","2016"
"254","DT.MAT.DPPG","Average maturity on new external debt commitments (years)",135,47,"1970","2016"
"255","DT.MAT.OFFT","Average maturity on new external debt commitments, official (years)",135,47,"1970","2016"
"256","DT.MAT.PRVT","Average maturity on new external debt commitments, private (years)",135,47,"1970","2016"
"257","DT.NFL.BLAT.CD","Net financial flows, bilateral (NFL, current USdollar)",136,47,"1970","2016"
"258","DT.NFL.BLTC.CD","PPG, bilateral concessional (NFL, current USdollar)",135,47,"1970","2016"
"259","DT.NFL.BOND.CD","Portfolio investment, bonds (PPG + PNG) (NFL, current USdollar)",135,47,"1970","2016"
"260","DT.NFL.DECT.CD","Net flows on external debt, total (NFL, current USdollar)",135,47,"1970","2016"
"261","DT.NFL.DLXF.CD","Net flows on external debt, long-term (NFL, current USdollar)",135,47,"1970","2016"
